{
  "$schema": "https://json-schema.org/draft/2020-12/schema",
  "$id": "https://jocky.dev/schemas/v1/forensic-record.schema.json",
  "title": "ForensicRecord",
  "description": "Integrity-addressed result record produced by a future read-only forensic collector.",
  "type": "object",
  "additionalProperties": false,
  "required": [
    "schema_version",
    "record_id",
    "case_id",
    "task_id",
    "endpoint_id",
    "collected_at",
    "collector",
    "category",
    "record_type",
    "sequence",
    "payload",
    "content_sha256"
  ],
  "properties": {
    "schema_version": {
      "const": "1.0.0"
    },
    "record_id": {
      "type": "string",
      "format": "uuid",
      "pattern": "^[0-9a-fA-F]{8}-[0-9a-fA-F]{4}-[0-9a-fA-F]{4}-[0-9a-fA-F]{4}-[0-9a-fA-F]{12}$"
    },
    "case_id": {
      "type": "string",
      "format": "uuid",
      "pattern": "^[0-9a-fA-F]{8}-[0-9a-fA-F]{4}-[0-9a-fA-F]{4}-[0-9a-fA-F]{4}-[0-9a-fA-F]{12}$"
    },
    "task_id": {
      "type": "string",
      "format": "uuid",
      "pattern": "^[0-9a-fA-F]{8}-[0-9a-fA-F]{4}-[0-9a-fA-F]{4}-[0-9a-fA-F]{4}-[0-9a-fA-F]{12}$"
    },
    "endpoint_id": {
      "type": "string",
      "format": "uuid",
      "pattern": "^[0-9a-fA-F]{8}-[0-9a-fA-F]{4}-[0-9a-fA-F]{4}-[0-9a-fA-F]{4}-[0-9a-fA-F]{12}$"
    },
    "collected_at": {
      "type": "string",
      "format": "date-time",
      "pattern": "^\\d{4}-\\d{2}-\\d{2}T\\d{2}:\\d{2}:\\d{2}(?:\\.\\d+)?Z$"
    },
    "collector": {
      "type": "object",
      "additionalProperties": false,
      "required": ["name", "version"],
      "properties": {
        "name": {
          "type": "string",
          "minLength": 1,
          "maxLength": 128
        },
        "version": {
          "type": "string",
          "minLength": 1,
          "maxLength": 64
        }
      }
    },
    "category": {
      "type": "string",
      "enum": [
        "system",
        "process",
        "network",
        "file",
        "event",
        "persistence",
        "driver",
        "indicator"
      ]
    },
    "record_type": {
      "type": "string",
      "pattern": "^[a-z][a-z0-9_.-]*$",
      "maxLength": 128
    },
    "sequence": {
      "type": "integer",
      "minimum": 0
    },
    "payload": {
      "type": "object"
    },
    "content_sha256": {
      "type": "string",
      "pattern": "^[a-f0-9]{64}$"
    }
  }
}

