{
  "schema_version": "1.0.0",
  "record_id": "44444444-4444-4444-8444-444444444444",
  "case_id": "aaaaaaaa-aaaa-4aaa-8aaa-aaaaaaaaaaaa",
  "task_id": "22222222-2222-4222-8222-222222222222",
  "endpoint_id": "11111111-1111-4111-8111-111111111111",
  "collected_at": "2026-08-30T12:02:00Z",
  "collector": {
    "name": "synthetic-fixture",
    "version": "0.0.0"
  },
  "category": "system",
  "record_type": "system.profile",
  "sequence": 0,
  "payload": {
    "fixture": true,
    "description": "Non-sensitive contract test data"
  },
  "content_sha256": "bbbbbbbbbbbbbbbbbbbbbbbbbbbbbbbbbbbbbbbbbbbbbbbbbbbbbbbbbbbbbbbb"
}

